{
  "patchName": "<afx acid3>\u0000",
  "drive": { "name": "Drive", "value": 0 },
  "keyboardOctave": { "name": "Keyboard Octave", "value": 0 },
  "syncRing": { "name": "Sync/Ring", "value": 1 },
  "seqTrig": { "name": "Seq Trig", "value": 0 },
  "oscilators": {
    "vco1": {
      "wave": { "name": "Wave", "value": 2 },
      "shape": { "name": "Shape", "value": 0 },
      "level": { "name": "Level", "value": 1023 },
      "pitch": { "name": "Pitch", "value": 512 },
      "octave": { "name": "Octave", "value": 1 }
    },
    "vco2": {
      "wave": { "name": "Wave", "value": 2 },
      "shape": { "name": "Shape", "value": 0 },
      "level": { "name": "Level", "value": 1023 },
      "pitch": { "name": "Pitch", "value": 1023 },
      "octave": { "name": "Octave", "value": 0 }
    }
  },
  "filter": {
    "cutoff": { "name": "Cutoff", "value": 488 },
    "resonance": { "name": "Resonance", "value": 909 }
  },
  "envelope": {
    "type": { "name": "Envelope Type", "value": 0 },
    "attack": { "name": "Attack", "value": 0 },
    "decay": { "name": "Decay", "value": 485 },
    "intensity": { "name": "Intensity", "value": 855 },
    "target": { "name": "Target", "value": 0 }
  },
  "lfo": {
    "wave": { "name": "Wave", "value": 1 },
    "mode": { "name": "LFO Mode", "value": 1 },
    "rate": { "name": "Rate", "value": 512 },
    "intensity": { "name": "Intensity", "value": 512 },
    "target": { "name": "Target", "value": 2 }
  },
  "programSettings": {
    "portamento": {
      "time": { "name": "time", "value": 0 },
      "mode": { "name": "mode", "value": 0 },
      "slideTime": { "name": "slideTime", "value": 36 }
    },
    "slider": {
      "assign": { "name": "assign", "value": 56 },
      "bendRangePlus": { "name": "bendRangePlus", "value": 3 },
      "bendRangeMinus": { "name": "bendRangeMinus", "value": 1 }
    },
    "pitch": {
      "microTuning": { "name": "microTuning", "value": 0 },
      "scaleKey": { "name": "scaleKey", "value": 12 },
      "programTuning": { "name": "programTuning", "value": 50 }
    },
    "other": {
      "lfoBpmSync": { "name": "lfoBpmSync", "value": 0 },
      "cutoffKeyTrack": { "name": "cutoffKeyTrack", "value": 0 },
      "cutoffVelocity": { "name": "cutoffVelocity", "value": 2 },
      "ampVelocity": { "name": "ampVelocity", "value": 0 },
      "programLevel": { "name": "programLevel", "value": 87 }
    }
  }
}
